NumberQuestion;Question;ChoiceQuestion;Answer
1; Which four can be thrown using the throw statement?; 1-Error, 2-Event, 3-Object, 4-Throwable, 5-Exception, 6-RuntimeException; 1,4,5,6
2; Which class or interface defines the wait(), notify(),and notifyAll() methods?; 1-object, 2-runnable, 3-thraed, 4-class; 1
3; Which of the following will not directly cause a thread to stop?; 1-notify(), 2-sleep(), 3-wait(), 4-all the above; 1
4;Which three guarantee that a thread will leave the running state?; 1-yield() 2-wait(), 3-notify(), 4-notifyAll(), 5-sleep(1000), 6-aLiveThread.join(); 2,5,6
5;Which two of the following methods are defined in class Thread?;1-start(), 2-wait(), 3-notify(), 4-run(); 1,4